<?xml version="1.0" encoding="UTF-8" standalone="no" ?>
<ROOT xmlns:xsi="http://www.w3.org/2001/XMLSchema-instance" xsi:noNamespaceSchemaLocation="../../ConfigurationBase.xsd">

 <HEADER>
  <TYPE>
   <EXTENSION_TABLE_NAME>DQM_HISTOS_CONSUMER_CONFIGURATION</EXTENSION_TABLE_NAME>
   <NAME>DQMHistosConsumerConfiguration</NAME>
  </TYPE>
  <RUN>
   <RUN_TYPE>DQMHistosConsumerConfiguration</RUN_TYPE>
   <RUN_NUMBER>1</RUN_NUMBER>
   <RUN_BEGIN_TIMESTAMP>2013-01-29 17:22:10</RUN_BEGIN_TIMESTAMP>
   <LOCATION>CERN P5</LOCATION>
  </RUN>
 </HEADER>

  <DATA_SET>
 
   <PART>
    <NAME_LABEL>CMS--ROOT</NAME_LABEL>
    <KIND_OF_PART>Detector ROOT</KIND_OF_PART>
   </PART>
   <VERSION>1</VERSION>
   <COMMENT_DESCRIPTION></COMMENT_DESCRIPTION>
   <CREATED_BY_USER></CREATED_BY_USER>

    <DATA> 
      <PROCESSOR_ID>DQMHistos0</PROCESSOR_ID>
      <FILE_PATH>/data/TestBeam/2016_06_June/OtsHistos/</FILE_PATH>
      <RADIX_FILE_NAME>DQMHistos0</RADIX_FILE_NAME>
      <SAVE_FILE>yes</SAVE_FILE>
    </DATA>

</DATA_SET>
</ROOT> 
