<?xml version="1.0" encoding="UTF-8" standalone="no" ?>
<ROOT xmlns:xsi="http://www.w3.org/2001/XMLSchema-instance" xsi:noNamespaceSchemaLocation="../../ConfigurationBase.xsd">

 <HEADER>
  <TYPE>
   <EXTENSION_TABLE_NAME>ARTDAQ_BUILDER_CONFIGURATION</EXTENSION_TABLE_NAME>
   <NAME>ARTDAQBuilderConfiguration</NAME>
  </TYPE>
  <RUN>
   <RUN_TYPE>ARTDAQBuilderConfiguration</RUN_TYPE>
   <RUN_NUMBER>1</RUN_NUMBER>
   <RUN_BEGIN_TIMESTAMP>2013-01-29 17:22:10</RUN_BEGIN_TIMESTAMP>
   <LOCATION>CERN P5</LOCATION>
  </RUN>
 </HEADER>

  <DATA_SET>
 
   <PART>
    <NAME_LABEL>CMS--ROOT</NAME_LABEL>
    <KIND_OF_PART>Detector ROOT</KIND_OF_PART>
   </PART>
   <VERSION>1</VERSION>
   <COMMENT_DESCRIPTION></COMMENT_DESCRIPTION>
   <CREATED_BY_USER></CREATED_BY_USER>
  
   <DATA>
    <SUPERVISOR_INSTANCE>1</SUPERVISOR_INSTANCE>
    <BUILDER_ID>1</BUILDER_ID>
    <STATUS>on</STATUS>
    <CONFIGURATION_STRING>
    	daq:
    	{
    		event_builder:
    		{
    			expected_fragments_per_event:1 
    			first_fragment_receiver_rank:0 
    			fragment_receiver_count:1 
    			mpi_buffer_count:16 
    			print_event_store_stats:true 
    			send_triggers:true 
    			trigger_port:5001 
    			use_art:true 
    			verbose:false
    		} 
    		max_fragment_size_words:2.097152e6
    	} 
    	outputs:
    	{
    		netMonOutput:
    		{
    			module_type:"RootMPIOutput"
    		}
    	} 
    	physics:
    	{
    		analyzers:
    		{
    			wf:
    			{
    				module_type:"WFViewer" 
    				fragment_ids:[0] 
    				fragment_type_labels:["STIB"] 
    				prescale:60 
    				write_to_file:true 
    				fileName:"/tmp/otsdaqdemo_onmon_evb.root"
    			}
    		}  
    		a1:["wf"] 
    		my_output_modules:["netMonOutput"]
    	} 
    	process_name:"DAQ" 
    	services:
    	{
    		Timing:
    		{
    			summaryOnly:true
    		} 
    		scheduler:
    		{
    			fileMode:"NOMERGE" 
    			errorOnFailureToPut: false
    		} 
    		user:
    		{
    			NetMonTransportServiceInterface:
    			{
    				data_receiver_count:1 
    				first_data_receiver_rank:2 
    				max_fragment_size_words:2.097152e6 
    				mpi_buffer_count:8 
    				service_provider:"NetMonTransportService"
    			}
    		}
    	} 
    	source:
    	{
    		fragment_type_map:[[1,"UDP"], [4,"STIB"]] 
    		module_type:"RawInput" 
    		resume_after_timeout:true 
    		waiting_time:900
    	}    	
    </CONFIGURATION_STRING>
   </DATA>

  
 </DATA_SET>
</ROOT> 
